{
  "$schema": "https://json-schema.org/draft/2020-12/schema",
  "$id": "https://raw.githubusercontent.com/YanlongLai/options-daily-report/main/schemas/ai_commentary.schema.json",
  "$schemaVersion": "1.0.0",
  "title": "Options AI Commentary — Daily Bilingual Snapshot",
  "description": "Bilingual (zh + en) AI market commentary for a single trading day. Written after each daily-report run. Version bump policy: schemas/VERSIONING.md.",
  "type": "object",
  "required": ["date", "generated_at", "tickers", "zh", "en"],
  "additionalProperties": false,

  "properties": {
    "date": {
      "type": "string",
      "pattern": "^\\d{4}-\\d{2}-\\d{2}$",
      "description": "Calendar date this commentary covers."
    },
    "generated_at": {
      "type": "string",
      "description": "ISO 8601 timestamp when the commentary was produced."
    },
    "tickers": {
      "type": "array",
      "items": { "type": "string", "pattern": "^[A-Z]{1,5}$" },
      "minItems": 1,
      "description": "Tickers analyzed in this commentary."
    },
    "zh": {
      "type": "string",
      "minLength": 50,
      "description": "Traditional Chinese markdown commentary. May contain inline [[pos|neg|key|warn|u:text]] highlight markers."
    },
    "en": {
      "type": "string",
      "minLength": 50,
      "description": "English markdown commentary. Same marker syntax as zh."
    },
    "model": {
      "type": "string",
      "description": "Optional — which Gemini model produced this run (for observability)."
    }
  }
}
