{
  "date": "2026-05-04",
  "generated_at": "2026-05-04T14:40:29",
  "tickers": [
    "TSLA",
    "AMZN",
    "NVDA"
  ],
  "zh": "> ⚠️ AI 市場解讀暫時無法使用（Gemini API error: 404 NOT_FOUND. {'error': {'code': 404, 'message': 'models/gemini-2.0-flash-exp is not found for API version v1beta, or is not supported for generateContent. Call ListModels to see the list of available models and their supported methods.', 'status': 'NOT_FOUND'}}）\n> 請設定 `GEMINI_API_KEY` 環境變數以啟用此功能。\n> 量化分析報告仍然完整可用。",
  "en": "## Professional Market Commentary (2026-05-04)\n\n### 📰 Today's Market Highlights\n\n**TSLA ($391.07)**\n1.  **EV Sector Headwinds and Competition:** News mentions \"Major automaker pulls the plug on ambitious U.S. EV plans\" and \"Tesla Rival Jumps On Strong Orders For Updated Model 3 Competitor\". This signals increasing competition and potential challenges within the broader EV market, which could put pressure on TSLA's market share and profitability. For options sellers, this implies a need for [[warn:careful strike selection]] to avoid downside risk.\n2.  **Strong Used Car Sales:** Conversely, \"Tesla Model X Becomes Fastest-Selling Used Car in U.S.\" suggests strong underlying demand for Tesla vehicles, even in the secondary market. This could act as a floor for sentiment and valuation, potentially cushioning significant drops.\n\n**AMZN ($274.38)**\n1.  **Expansion into Logistics Services:** \"Amazon Supply Chain Services opens logistics to all businesses\" is a significant strategic move. This positions Amazon to directly compete with established logistics giants like UPS and FedEx, potentially unlocking substantial new revenue streams and solidifying its market position beyond e-commerce. This is [[pos:a long-term bullish catalyst]].\n2.  **Big Tech Earnings Quality Concerns:** While not directly about Amazon's earnings, \"Big Tech profits are being inflated by stakes in private startups\" points to broader concerns about the underlying quality of Big Tech earnings. Investors may scrutinize revenue sources more closely, which could introduce volatility if sentiment shifts.\n\n**NVDA ($197.77)**\n1.  **AI Infrastructure Dominance:** Several articles reinforce NVIDIA's position at the core of the AI boom, noting \"These Three Titans Own the AI Infrastructure Layer That Actually Matters\". This reiterates its crucial role and continued demand for its products, supporting a [[pos:strong fundamental outlook]].\n2.  **Valuation Concerns in AI Sector:** News mentioning \"Is Cloudflare Overvalued at 182x Earnings?\" and \"Skip the SoundHound Hype\" suggests some market participants are becoming cautious about valuations within the broader AI-related tech space. While NVDA's forward P/E is 17.6, the overall sentiment could lead to sector-wide pullbacks.\n\n### 📊 Bull/Bear Outlook\n\n**TSLA**\n*   **Outlook**: [[u:Bullish]]\n*   **Rationale**: Despite EV sector competition, TSLA's positive news on used car sales and the quantitative model's \"Bullish\" direction signal with 74% confidence suggest an upward bias. The high IV associated with the upcoming FOMC meeting makes premium selling attractive, especially with defined-risk strategies. Support at [[key:$350 (-10.5%)]] based on max put OI.\n\n**AMZN**\n*   **Outlook**: [[u:Neutral to Slightly Bullish]]\n*   **Rationale**: Amazon's strategic expansion into logistics is a strong positive, and analyst consensus is overwhelmingly bullish. However, the model shows a low directional confidence (30%) and a [[neg:negative selling margin (-0.14%)]]. P/C OI ratio of 0.55 also suggests bullish sentiment from options traders. The optimal timing analysis recommends waiting until Thursday, indicating current conditions might not be ideal for immediate entry. Resistance at [[key:$260 (-5.2%)]] and Max Pain at $225 (-18%).\n\n**NVDA**\n*   **Outlook**: [[u:Neutral]]\n*   **Rationale**: NVIDIA remains a key player in AI, but the quantitative model indicates a \"Neutral\" direction with low confidence (17%) and a \"Neutral\" IV signal. Option positioning shows resistance at [[key:$200 (+1.1%)]] and max pain at $190 (-3.9%). The timing analysis suggests waiting until Friday, aligning with a more cautious approach given the overall market's \"NORMAL\" but \"謹慎操作\" recommendation.\n\n### 🎯 Strategy Recommendations\n\n1.  **Sell Put or Sell Call Suitability**:\n    Given the overall market environment is [[u:🟡 NORMAL]] with a VIX of 17.16 (indicating moderate volatility) and the approaching [[warn:FOMC Meeting on May 6th]] (expected to elevate IV), **Sell Put strategies (specifically Bull Put Spreads)** are more suitable. This aligns with the overall \"Bullish\" or \"Neutral\" directional signals for the recommended tickers. The increased IV ahead of the event offers richer premiums, and selling puts below perceived support levels allows for capitalizing on potential slight upward movement or sideways consolidation while defining risk.\n\n2.  **Optimal Trade per Ticker**:\n    *   **TSLA**: [[pos:Bull Put Spread (Sell $371 / Buy $352)]] expiring around 1-2 weeks out (e.g., May 16th or May 23rd expiry, assuming weekly options are available). The strike $371 is below the current price of $391.07, targeting the reported \"Bullish\" sentiment and utilizing the heavy put support at $350. The optimal timing recommends \"SELL NOW\".\n    *   **AMZN**: [[pos:Bull Put Spread (Sell $261 / Buy $247)]] expiring around 1-2 weeks out. While the IV selling margin is negative, the strong analyst consensus and bullish options positioning offer some confidence. It is crucial to heed the \"[[warn:WAIT until Thursday 13:30]]\" recommendation for better entry.\n    *   **NVDA**: [[pos:Bull Put Spread (Sell $188 / Buy $178)]] expiring around 1-2 weeks out. This strategy aligns with the \"Neutral\" direction and aims to profit from the stock remaining above the strong put support at $190. However, the optimal timing suggests \"[[warn:WAIT until Friday]]\" for a more favorable entry.\n\n3.  **Stop/Adjustment**:\n    *   For all recommended spread strategies, it is critical to implement a [[warn:strict stop-loss (2x premium)]] as suggested by the report. For example, if a spread collects $1.00 in premium, the maximum loss should be capped at $2.00 per share by buying back the spread.\n    *   Monitor the underlying price action relative to the short strike. If the underlying breaches the short strike and shows further weakness, consider rolling the spread down and out for a credit or closing the position entirely.\n    *   Given the FOMC meeting on May 6th, consider closing positions or rolling out before the event if the market becomes overly volatile or if the directional conviction weakens.\n\n### ⚠️ Risk Events This Week\n\n*   **2026-05-06 (in 2 days): FOMC Meeting (High Impact)**: This is the primary event risk for the week. Interest rate decisions, forward guidance, and economic projections from the Federal Reserve can significantly impact market sentiment, especially for growth stocks like TSLA, AMZN, and NVDA. Expect [[pos:elevated IV ahead of the meeting]], which can be beneficial for selling premium, but also increased volatility following the announcement.\n\n### 💡 Additional Observations\n\n*   **Correlation & Diversification**: The average correlation is 0.45, slightly higher than the historical 0.33, but still categorized as \"🟢 NORMAL / falling\". This suggests that while these tech giants exhibit some interconnectedness, standard position sizing is appropriate. However, due to the high-impact FOMC event, maintaining [[u:diversification across sectors]] beyond just these tech names is prudent.\n*   **Timing is Key**: The \"Optimal Timing Analysis\" provides specific windows for entry. For AMZN and NVDA, waiting for the recommended times could significantly improve trade entry quality and premium collection. TSLA is the only ticker recommended for \"SELL NOW\", suggesting its current IV and setup are most favorable.\n*   **VIX vs. HV**: VIX is at 17.16, while HV20 is lower at 12.0%. This implies that [[key:market-implied volatility (VIX)]] is higher than recent historical realized volatility. This environment is generally favorable for options sellers, as premiums are relatively richer compared to actual price movements, especially for defined-risk strategies like spreads.\n\n***\n\n*Disclaimer: The information provided in this commentary is based on quantitative models and market data as of 2026-05-04 and is for informational purposes only. It does not constitute investment advice. Options trading involves substantial risk and is not suitable for all investors. Always consult with a qualified financial professional before making any investment decisions.*"
}