{
  "date": "2025-04-22",
  "generated_at": "2026-04-23T00:30:29",
  "tickers": [
    "TSLA",
    "AMZN",
    "NVDA"
  ],
  "zh": "> ⚠️ AI 市場解讀暫時無法使用（GEMINI_API_KEY not set）\n> 請設定 `GEMINI_API_KEY` 環境變數以啟用此功能。\n> 量化分析報告仍然完整可用。",
  "en": "> ⚠️ AI 市場解讀暫時無法使用（GEMINI_API_KEY not set）\n> 請設定 `GEMINI_API_KEY` 環境變數以啟用此功能。\n> 量化分析報告仍然完整可用。"
}