{
  "date": "2026-05-14",
  "generated_at": "2026-05-14T16:47:06",
  "tickers": [
    "AAPL"
  ],
  "zh": "> ⚠️ AI 市場解讀暫時無法使用（GEMINI_API_KEY not set）\n> 請設定 `GEMINI_API_KEY` 環境變數以啟用此功能。\n> 量化分析報告仍然完整可用。",
  "en": "> ⚠️ AI 市場解讀暫時無法使用（GEMINI_API_KEY not set）\n> 請設定 `GEMINI_API_KEY` 環境變數以啟用此功能。\n> 量化分析報告仍然完整可用。"
}